{
	"_id": "624c94fa-9ebc-4f8b-8389-f5959149a0a7:0c243e08-8c21-4946-9f5f-ce255106901b:8a7980f8-0e47-49bb-bf54-fdbe2013e3ea:2010-02",
	"type": "input",
	"project": "624c94fa-9ebc-4f8b-8389-f5959149a0a7",
	"entity": "0c243e08-8c21-4946-9f5f-ce255106901b",
	"form": "8a7980f8-0e47-49bb-bf54-fdbe2013e3ea",
	"period": "2010-02",
	"values": {
		"c0cdae8e-4ebb-41e3-a68e-d8247d3ca7ce": [1, 2, 3, 4, 5, 6, 7, 8, 9, 10, 11, 12],
		"a83cda13-fbc7-477d-b158-33077a243c81": [1]
	}
}